{
  "$component": "aihio-toggle",
  "version": "2.0.0",
  "description": "A button that stays pressed or unpressed, such as Bold in a text toolbar. It renders a real <button aria-pressed>.",
  "intents": [
    "toggle-state",
    "action"
  ],
  "attributes": {
    "pressed": {
      "type": "boolean",
      "default": false,
      "description": "Whether the toggle is pressed"
    },
    "disabled": {
      "type": "boolean",
      "default": false,
      "description": "Disables the toggle"
    },
    "variant": {
      "type": "enum",
      "values": [
        "default",
        "outline"
      ],
      "default": "default",
      "description": "Visual style variant"
    },
    "size": {
      "type": "enum",
      "values": [
        "sm",
        "md",
        "lg"
      ],
      "default": "md",
      "description": "Toggle size"
    }
  },
  "slots": {
    "default": {
      "description": "Toggle label content"
    }
  },
  "events": {
    "aihio-toggle": {
      "description": "Fired when the pressed state changes",
      "detail": {
        "pressed": "boolean"
      }
    }
  },
  "composition": {
    "forbiddenChildren": [
      "aihio-button",
      "aihio-toggle",
      "aihio-input"
    ]
  },
  "a11yContract": {
    "handled": [
      "The component renders a real <button> with aria-pressed, so the role, Enter and Space activation, focus behaviour, disabled semantics, and the forced-colours mapping are the platform's rather than an emulation of them",
      "aria-pressed on that control reflects the pressed attribute",
      "aria-* set on the host is mirrored onto the control",
      "The control is always type=\"button\", so a toggle inside a form never submits it"
    ],
    "required": [
      {
        "when": "toggle has no visible text (icon-only)",
        "requirement": "Provide aria-label describing what the toggle controls (e.g. aria-label=\"Bold\").",
        "severity": "error",
        "rule": "toggle-accessible-name"
      },
      {
        "when": "the toggle turns a setting on or off, or is named by a state word (On, Enabled)",
        "requirement": "Name the toggle after what it controls (e.g. \"Bold\"), never after its state: a toggle labelled \"Enabled\" is announced as \"Enabled, toggle button, pressed\" and never says what is enabled. For an on/off setting in a form, use aihio-switch.",
        "severity": "warn",
        "rule": "toggle-state-name"
      }
    ]
  },
  "counterExamples": [
    {
      "markup": "<aihio-toggle><aihio-button>B</aihio-button></aihio-toggle>",
      "reason": "Nested interactives. Use aihio-toggle alone — it already renders a button.",
      "fix": "<aihio-toggle aria-label=\"Bold\">B</aihio-toggle>",
      "rule": "forbidden-descendant"
    },
    {
      "markup": "<aihio-toggle pressed=\"false\">Bold</aihio-toggle>",
      "reason": "Boolean attributes toggle on presence. Omit the attribute for unpressed; write `pressed` for pressed.",
      "fix": "<aihio-toggle>Bold</aihio-toggle>",
      "rule": "boolean-attribute-value"
    },
    {
      "markup": "<span>Email notifications</span>\n<aihio-toggle pressed>Enabled</aihio-toggle>",
      "reason": "The toggle is named by its state and the visible label is not associated with it, so assistive technology announces \"Enabled, toggle button, pressed\" with no idea what is enabled. An on/off setting is a switch: use aihio-switch in aihio-field, which also submits with the form.",
      "fix": "<aihio-field>\n  <label slot=\"label\">Email notifications</label>\n  <aihio-switch name=\"email-notifications\" checked></aihio-switch>\n</aihio-field>",
      "rule": "toggle-state-name"
    }
  ],
  "examples": [
    {
      "title": "Unpressed",
      "markup": "<aihio-toggle>Bold</aihio-toggle>"
    },
    {
      "title": "Pressed and outlined",
      "description": "pressed is a boolean attribute: present means on.",
      "markup": "<aihio-toggle pressed variant=\"outline\">Italic</aihio-toggle>"
    }
  ],
  "properties": {
    "control": {
      "type": "HTMLButtonElement | null",
      "readonly": true,
      "description": "The native button delegated to by the component"
    },
    "pressed": {
      "type": "boolean",
      "description": "Whether the toggle is pressed; reflects the pressed attribute"
    }
  },
  "methods": {
    "click()": {
      "description": "Activates the native button, toggling the pressed state.",
      "returns": "void"
    },
    "focus()": {
      "description": "Moves focus to the native button.",
      "parameters": [
        {
          "name": "options",
          "type": "FocusOptions",
          "optional": true
        }
      ],
      "returns": "void"
    },
    "blur()": {
      "description": "Removes focus from the native button.",
      "returns": "void"
    }
  }
}
