{
  "$component": "aihio-alert",
  "version": "1.1.0",
  "description": "A callout for a message the user should notice where it is shown: a failed save, a confirmation that something worked, a warning about a setting. Only the destructive variant interrupts a screen reader.",
  "intents": [
    "alert",
    "informational",
    "status"
  ],
  "attributes": {
    "variant": {
      "type": "enum",
      "values": [
        "default",
        "success",
        "warning",
        "destructive"
      ],
      "default": "default",
      "description": "Visual and live-region emphasis. destructive announces assertively; success, warning, and default announce politely."
    }
  },
  "slots": {
    "default": {
      "description": "Alert content"
    },
    "title": {
      "description": "Alert title (use slot=\"title\")"
    },
    "description": {
      "description": "Alert description (use slot=\"description\")"
    }
  },
  "composition": {
    "allowedSlots": [
      "default",
      "title",
      "description"
    ],
    "forbiddenChildren": [
      "aihio-button",
      "aihio-toggle",
      "aihio-switch",
      "aihio-input",
      "aihio-combobox",
      "aihio-dropdown",
      "aihio-dialog"
    ]
  },
  "a11yContract": {
    "handled": [
      "role=\"alert\" (assertive) is set for variant=\"destructive\"; other variants get role=\"status\" (polite) so a confirmation does not interrupt the screen reader",
      "An author-provided role is always left alone"
    ],
    "required": [
      {
        "when": "variant=\"destructive\"",
        "requirement": "Include slot=\"title\" or slot=\"description\" so assistive tech has content to announce. Colour alone is not a sufficient signal.",
        "severity": "warn",
        "rule": "alert-announced-content"
      },
      {
        "when": "role is set on the alert to anything but its variant's own (alert for destructive, status otherwise)",
        "requirement": "Remove the role and let the variant set it: role=\"alert\" for destructive, which interrupts the screen reader, and role=\"status\" for the rest, which waits its turn.",
        "severity": "error",
        "rule": "alert-role"
      }
    ]
  },
  "counterExamples": [
    {
      "markup": "<aihio-alert variant=\"error\">Oops</aihio-alert>",
      "reason": "variant=\"error\" is not valid. Use variant=\"destructive\" for error states.",
      "fix": "<aihio-alert variant=\"destructive\">\n  <div slot=\"title\">Could not save</div>\n</aihio-alert>",
      "rule": "invalid-enum-attribute"
    },
    {
      "markup": "<aihio-alert><aihio-button>OK</aihio-button></aihio-alert>",
      "reason": "Alerts are non-interactive surfaces. For acknowledgeable prompts use aihio-dialog.",
      "fix": "<aihio-alert>\n  <div slot=\"title\">Your changes were saved</div>\n</aihio-alert>",
      "rule": "forbidden-descendant"
    },
    {
      "markup": "<aihio-alert variant=\"success\" role=\"alert\">Saved</aihio-alert>",
      "reason": "role=\"alert\" interrupts the screen reader. A confirmation should announce politely — drop the role and let the success variant set role=\"status\".",
      "fix": "<aihio-alert variant=\"success\">Saved</aihio-alert>",
      "rule": "alert-role"
    }
  ],
  "examples": [
    {
      "title": "Default",
      "description": "Neutral information, announced politely as role=\"status\".",
      "markup": "<aihio-alert>\n  <div slot=\"title\">Heads up!</div>\n  <div slot=\"description\">You can add components to your app.</div>\n</aihio-alert>"
    },
    {
      "title": "Destructive",
      "description": "A failure: the one variant announced assertively, as role=\"alert\".",
      "markup": "<aihio-alert variant=\"destructive\">\n  <div slot=\"title\">Error</div>\n  <div slot=\"description\">Something went wrong.</div>\n</aihio-alert>"
    },
    {
      "title": "Success",
      "description": "A confirmation that something worked.",
      "markup": "<aihio-alert variant=\"success\">\n  <div slot=\"title\">Changes saved</div>\n  <div slot=\"description\">Your profile is up to date.</div>\n</aihio-alert>"
    },
    {
      "title": "Warning",
      "description": "Something that needs attention but has not failed.",
      "markup": "<aihio-alert variant=\"warning\">\n  <div slot=\"title\">Trial ends in 3 days</div>\n  <div slot=\"description\">Add a payment method to keep your workspace active.</div>\n</aihio-alert>"
    }
  ]
}
